{
  "formatVersion": 1,
  "type": "TextImageQueryGroundTruth",
  "dataset": {
    "id": "generated-scaffold-only",
    "version": "v1",
    "license": "generated data only; no third-party media",
    "containsCustomerMedia": false
  },
  "queries": [],
  "notes": "Schema scaffold only. Empty records are not a semantic retrieval evaluation."
}
